{
  "$schema": "./structure-template.schema.json",
  "schemaVersion": 1,
  "key": "bank",
  "name": "بانکی",
  "description": "نمونه‌ی عمومی ساختار یک بانک بر پایه‌ی دستورالعمل حاکمیت شرکتی: مجمع عمومی، هیأت مدیره و کمیته‌های آن (با خط نقطه‌چین)، مدیریت عامل با واحدهای ستادی رایج، چند معاونت و مدیریت امور با اداره‌های کل نمونه، و مدیریت شعب. فقط نقطه‌ی شروع است: بعد از ساخت، نام‌ها را مطابق سازمان خود تغییر دهید و بخش‌ها را اضافه یا حذف کنید. مجمع، هیأت مدیره و کمیته‌ها مدیر ندارند و پستی برایشان ساخته نمی‌شود، پس مدیرعامل بالاترین فرد زنجیره‌ی مدیریت است.",
  "uiLevel": "advanced",
  "nodeTypes": [
    { "key": "general-assembly", "name": "مجمع عمومی", "color": "#475569", "icon": "landmark", "isDomainBoundary": true },
    { "key": "board", "name": "هیأت مدیره", "color": "#1e3a8a", "icon": "users", "isDomainBoundary": true },
    { "key": "committee", "name": "کمیته", "color": "#7c3aed", "icon": "users-round", "isDomainBoundary": true },
    { "key": "ceo-office", "name": "مدیریت عامل", "color": "#b45309", "icon": "crown", "isDomainBoundary": true },
    { "key": "staff-unit", "name": "واحد ستادی", "color": "#4d7c0f", "icon": "building", "isDomainBoundary": true },
    { "key": "deputy", "name": "معاونت", "color": "#0f766e", "icon": "building-2", "isDomainBoundary": true },
    { "key": "affairs-management", "name": "مدیریت امور", "color": "#0369a1", "icon": "briefcase", "isDomainBoundary": true },
    { "key": "general-department", "name": "اداره کل", "color": "#2563eb", "icon": "folder-tree", "isDomainBoundary": false },
    { "key": "office", "name": "اداره", "color": "#64748b", "icon": "folder", "isDomainBoundary": false },
    { "key": "branch-management", "name": "مدیریت شعب استان / منطقه", "color": "#be123c", "icon": "map-pin", "isDomainBoundary": true },
    { "key": "branch", "name": "شعبه", "color": "#c2410c", "icon": "store", "isDomainBoundary": false }
  ],
  "rules": [
    { "parent": null, "child": "general-assembly" },
    { "parent": null, "child": "committee" },
    { "parent": "general-assembly", "child": "board" },
    { "parent": "board", "child": "ceo-office" },
    { "parent": "ceo-office", "child": "staff-unit" },
    { "parent": "ceo-office", "child": "deputy" },
    { "parent": "ceo-office", "child": "affairs-management" },
    { "parent": "ceo-office", "child": "branch-management" },
    { "parent": "staff-unit", "child": "office" },
    { "parent": "deputy", "child": "general-department" },
    { "parent": "affairs-management", "child": "general-department" },
    { "parent": "affairs-management", "child": "branch" },
    { "parent": "general-department", "child": "office" },
    { "parent": "branch-management", "child": "branch" }
  ],
  "linkTypes": [
    { "key": "board-committee", "name": "کمیته‌ی هیأت مدیره", "lineStyle": "dotted", "countsAsManager": false },
    { "key": "oversight", "name": "نظارت تخصصی", "lineStyle": "dotted", "countsAsManager": false }
  ],
  "autoLinkRules": [
    { "sourceType": "committee", "targetType": "board", "linkType": "board-committee" }
  ],
  "positions": [
    { "key": "ceo", "title": "مدیرعامل", "parent": null },
    { "key": "deputy-ceo", "title": "قائم‌مقام مدیرعامل", "parent": "ceo" },
    { "key": "vp", "title": "معاون", "parent": "ceo" },
    { "key": "affairs-manager", "title": "مدیر امور", "parent": "ceo" },
    { "key": "general-manager", "title": "مدیر کل", "parent": "vp" },
    { "key": "branch-region-manager", "title": "مدیر شعب استان / منطقه", "parent": "vp" },
    { "key": "office-head", "title": "رئیس اداره", "parent": "general-manager" },
    { "key": "expert", "title": "کارشناس", "parent": "office-head" },
    { "key": "branch-head", "title": "رئیس شعبه", "parent": "branch-region-manager" },
    { "key": "branch-deputy", "title": "معاون شعبه", "parent": "branch-head" },
    { "key": "branch-staff", "title": "کارمند شعبه", "parent": "branch-deputy" }
  ],
  "postTemplates": [
    {
      "nodeType": "ceo-office",
      "posts": [
        { "position": "ceo", "isManagerPost": true, "isCompanyHead": true },
        { "position": "deputy-ceo" }
      ]
    },
    {
      "nodeType": "staff-unit",
      "posts": [
        { "position": "general-manager", "isManagerPost": true },
        { "position": "expert" }
      ]
    },
    {
      "nodeType": "deputy",
      "posts": [
        { "position": "vp", "isManagerPost": true }
      ]
    },
    {
      "nodeType": "affairs-management",
      "posts": [
        { "position": "affairs-manager", "isManagerPost": true }
      ]
    },
    {
      "nodeType": "general-department",
      "posts": [
        { "position": "general-manager", "isManagerPost": true },
        { "position": "expert" }
      ]
    },
    {
      "nodeType": "office",
      "posts": [
        { "position": "office-head", "isManagerPost": true },
        { "position": "expert" }
      ]
    },
    {
      "nodeType": "branch-management",
      "posts": [
        { "position": "branch-region-manager", "isManagerPost": true }
      ]
    },
    {
      "nodeType": "branch",
      "posts": [
        { "position": "branch-head", "isManagerPost": true },
        { "position": "branch-deputy" },
        { "position": "branch-staff" }
      ]
    }
  ],
  "companyPosts": [],
  "nodes": [
    {
      "key": "general-assembly",
      "name": "مجمع عمومی",
      "type": "general-assembly",
      "children": [
        {
          "key": "board",
          "name": "هیأت مدیره",
          "type": "board",
          "children": [
            {
              "key": "ceo-office",
              "name": "مدیریت عامل",
              "type": "ceo-office",
              "children": [
                { "key": "internal-audit", "name": "اداره کل حسابرسی داخلی", "type": "staff-unit" },
                { "key": "legal", "name": "اداره کل حقوقی", "type": "staff-unit" },
                { "key": "public-relations", "name": "اداره کل روابط عمومی", "type": "staff-unit" },
                { "key": "risk-management", "name": "اداره کل مدیریت ریسک", "type": "staff-unit" },
                { "key": "compliance", "name": "اداره کل تطبیق و رعایت قوانین", "type": "staff-unit" },
                { "key": "anti-money-laundering", "name": "اداره کل مبارزه با پولشویی", "type": "staff-unit" },
                {
                  "key": "finance",
                  "name": "معاونت مالی",
                  "type": "deputy",
                  "children": [
                    { "key": "accounting", "name": "اداره کل حسابداری", "type": "general-department" },
                    { "key": "budget", "name": "اداره کل بودجه", "type": "general-department" }
                  ]
                },
                {
                  "key": "information-technology",
                  "name": "معاونت فناوری اطلاعات",
                  "type": "deputy",
                  "children": [
                    { "key": "software-systems", "name": "اداره کل سامانه‌ها", "type": "general-department" },
                    { "key": "security-infrastructure", "name": "اداره کل زیرساخت و امنیت", "type": "general-department" }
                  ]
                },
                {
                  "key": "human-capital",
                  "name": "معاونت منابع انسانی و پشتیبانی",
                  "type": "deputy",
                  "children": [
                    { "key": "human-resources", "name": "اداره کل منابع انسانی", "type": "general-department" },
                    { "key": "support", "name": "اداره کل پشتیبانی", "type": "general-department" }
                  ]
                },
                {
                  "key": "credit",
                  "name": "معاونت اعتباری",
                  "type": "deputy",
                  "children": [
                    { "key": "credits", "name": "اداره کل اعتبارات", "type": "general-department" },
                    { "key": "claims-collection", "name": "اداره کل وصول مطالبات", "type": "general-department" }
                  ]
                },
                {
                  "key": "branch-affairs-management",
                  "name": "مدیریت امور شعب",
                  "type": "affairs-management",
                  "children": [
                    { "key": "branch-affairs", "name": "اداره کل امور شعب", "type": "general-department" }
                  ]
                },
                {
                  "key": "inspection",
                  "name": "مدیریت امور بازرسی",
                  "type": "affairs-management",
                  "children": [
                    { "key": "inspection-supervision", "name": "اداره کل بازرسی و نظارت", "type": "general-department" }
                  ]
                },
                { "key": "branch-management", "name": "مدیریت شعب استان / منطقه", "type": "branch-management" }
              ]
            }
          ]
        }
      ]
    },
    { "key": "it-committee", "name": "کمیته عالی فناوری اطلاعات", "type": "committee" },
    { "key": "remuneration-committee", "name": "کمیته جبران خدمات", "type": "committee" },
    { "key": "audit-committee", "name": "کمیته حسابرسی", "type": "committee" },
    { "key": "compliance-committee", "name": "کمیته رعایت قوانین و مقررات", "type": "committee" },
    { "key": "risk-committee", "name": "کمیته مدیریت ریسک", "type": "committee" }
  ],
  "links": [
    { "source": "internal-audit", "target": "board", "type": "oversight" },
    { "source": "internal-audit", "target": "audit-committee", "type": "oversight" },
    { "source": "risk-management", "target": "risk-committee", "type": "oversight" },
    { "source": "compliance", "target": "compliance-committee", "type": "oversight" }
  ]
}
